{
  "$schema": "http://json-schema.org/draft-07/schema#",
  "title": "PEV Verification (database-schema-design)",
  "type": "object",
  "required": ["verdict", "scores", "store_reviews", "cross_review", "gates", "confidence"],
  "properties": {
    "verdict": {
      "type": "string",
      "enum": ["PASS", "REVISE", "REPLAN", "BLOCKED"]
    },
    "scores": {
      "type": "object",
      "description": "整体 7 维各 1-5 分(逐库评分见 store_reviews),判据见 rubrics/db-review.md",
      "required": ["upstream_conformance", "schema_clarity", "consistency", "compatibility", "tradeoff_honesty", "simplicity", "traceability"],
      "properties": {
        "upstream_conformance": {"type": "integer", "minimum": 1, "maximum": 5},
        "schema_clarity": {"type": "integer", "minimum": 1, "maximum": 5},
        "consistency": {"type": "integer", "minimum": 1, "maximum": 5},
        "compatibility": {"type": "integer", "minimum": 1, "maximum": 5},
        "tradeoff_honesty": {"type": "integer", "minimum": 1, "maximum": 5},
        "simplicity": {"type": "integer", "minimum": 1, "maximum": 5},
        "traceability": {"type": "integer", "minimum": 1, "maximum": 5}
      }
    },
    "store_reviews": {
      "type": "array",
      "description": "逐库评审结论;PASS 要求全部 verdict=PASS 且覆盖全部目标库(validate.py 强制)",
      "items": {
        "type": "object",
        "required": ["store_id", "verdict", "scores"],
        "properties": {
          "store_id": {"type": "string", "description": "必须 ⊆ artifact 设计过的库 id(validate.py 强制)"},
          "verdict": {"type": "string", "enum": ["PASS", "REVISE"]},
          "scores": {
            "type": "object",
            "required": ["upstream_conformance", "schema_clarity", "consistency", "compatibility", "tradeoff_honesty", "simplicity", "traceability"],
            "properties": {
              "upstream_conformance": {"type": "integer", "minimum": 1, "maximum": 5},
              "schema_clarity": {"type": "integer", "minimum": 1, "maximum": 5},
              "consistency": {"type": "integer", "minimum": 1, "maximum": 5},
              "compatibility": {"type": "integer", "minimum": 1, "maximum": 5},
              "tradeoff_honesty": {"type": "integer", "minimum": 1, "maximum": 5},
              "simplicity": {"type": "integer", "minimum": 1, "maximum": 5},
              "traceability": {"type": "integer", "minimum": 1, "maximum": 5}
            }
          },
          "critical_issues": {"type": "array", "items": {"type": "string"}}
        }
      }
    },
    "cross_review": {
      "type": "object",
      "description": "Cross 跨库一致性评审(全部库 PASS 后执行);verdict=revise 时整体不得 PASS(validate.py 强制)",
      "required": ["verdict"],
      "properties": {
        "verdict": {"type": "string", "enum": ["pass", "revise"]},
        "checked_items": {"type": "array", "items": {"type": "string"}, "description": "核查过的跨库检查项(命名与概念一致/ID 与键策略/冗余权威源/演进策略一致)"},
        "findings": {
          "type": "array",
          "items": {
            "type": "object",
            "required": ["id", "severity", "what", "why", "what_must_change", "affected_stores"],
            "properties": {
              "id": {"type": "string", "description": "如 X1"},
              "severity": {"type": "string", "enum": ["BLOCKING", "HIGH", "MEDIUM", "LOW"]},
              "what": {"type": "string"},
              "why": {"type": "string"},
              "what_must_change": {"type": "string"},
              "affected_stores": {"type": "array", "items": {"type": "string"}, "minItems": 1}
            }
          }
        }
      }
    },
    "gates": {
      "type": "object",
      "description": "五个门禁布尔照抄 validate.py 打印的值(逐位比对;不适用时脚本按 true 计并注明)",
      "required": ["stores_complete", "entities_within_upstream", "upstream_mapped", "findings_disposed", "cross_consistent", "notes"],
      "properties": {
        "stores_complete": {"type": "boolean"},
        "entities_within_upstream": {"type": "boolean"},
        "upstream_mapped": {"type": "boolean"},
        "findings_disposed": {"type": "boolean"},
        "cross_consistent": {"type": "boolean"},
        "notes": {"type": "string", "description": "对五值的质疑与补充(如:结构守恒但快照疑似漏抄 owns_data,交 upstream_conformance 维度扣分)"}
      }
    },
    "strengths": {"type": "array", "items": {"type": "string"}},
    "critical_issues": {
      "type": "array",
      "description": "verdict != PASS 时每条写清 What is wrong / Why it matters / What must change",
      "items": {"type": "string"}
    },
    "warnings": {"type": "array", "items": {"type": "string"}},
    "required_changes": {"type": "array", "items": {"type": "string"}},
    "evidence_gaps": {"type": "array", "items": {"type": "string"}},
    "findings": {
      "type": "array",
      "description": "结构化评审发现(反向追溯):每条携带 affected_upstream_items 回指声明过的数据/交互条目,便于 REVISE 精确定位",
      "items": {
        "type": "object",
        "required": ["id", "severity", "what", "why", "what_must_change", "affected_upstream_items"],
        "properties": {
          "id": {"type": "string"},
          "severity": {"type": "string", "enum": ["BLOCKING", "HIGH", "MEDIUM", "LOW"]},
          "what": {"type": "string"},
          "why": {"type": "string"},
          "what_must_change": {"type": "string"},
          "affected_upstream_items": {"type": "array", "items": {"type": "string"}, "minItems": 1},
          "dimension": {"type": "string"},
          "store_id": {"type": "string", "description": "可选:发现归属的库"}
        }
      }
    },
    "redlines": {
      "type": "array",
      "description": "红线处置(独立于 7 维评分):每条红线 id 来自 redlines/db-redlines.json;applies=true 且 passed=false 时不得判 PASS",
      "items": {
        "type": "object",
        "required": ["id", "applies", "details"],
        "properties": {
          "id": {"type": "string"},
          "applies": {"type": "boolean"},
          "passed": {"type": "boolean"},
          "details": {"type": "string"}
        }
      }
    },
    "confidence": {"type": "string", "enum": ["high", "medium", "low"]}
  }
}
